{
  "template_name": "快递寄件面单",
  "reference_width": 499,
  "reference_height": 281,
  "fields": [
    {
      "field_name": "字段1",
      "bbox": [
        162.0,
        241.0,
        288.0,
        281.0
      ],
      "match_mode": "center",
      "iou_threshold": 0.1
    },
    {
      "field_name": "字段2",
      "bbox": [
        51.0,
        241.0,
        178.0,
        281.0
      ],
      "match_mode": "center",
      "iou_threshold": 0.1
    },
    {
      "field_name": "字段3",
      "bbox": [
        77.0,
        119.0,
        200.0,
        153.0
      ],
      "match_mode": "center",
      "iou_threshold": 0.1
    }
  ]
}